"Title","Author","PublishedAt","Description","URL"
"K-beauty trends 2024: Beyond glass skin","Sushmita Jha","2024-03-15T06:49:24Z","Korean skincare trends, led by K-beauty, drive beauty evolution with innovation, inclusivity, and sustainability. From unique products to custom routines, K-beauty reshapes the industry, celebrating diversity and setting new skincare standards for the future.","https://timesofindia.indiatimes.com/life-style/beauty/k-beauty-trends-2024-beyond-glass-skin/articleshow/108515557.cms"
"How Ipsy Keeps Customers In the Know and Ahead of Beauty Trends","adweek.com","2024-03-12T21:22:08Z","Everyone has their favorite skincare and makeup products, but how do you keep up with the latest trends and discover new products before they become popular? Ipsy is a personalized beauty membership service that can help with that. Ipsy is a powerful marketin…","https://biztoc.com/x/e246aaafb3d22c32"
"Global Premium Skincare Products Market Set to Reach $78.7 Billion by 2030 Amid Rising Consumer Interest in Luxury Beauty","Research and Markets","2024-03-15T09:15:00Z","Dublin, March 15, 2024 (GLOBE NEWSWIRE) -- The ""Premium Skincare Products: Global Strategic Business Report"" report has been added to ResearchAndMarkets.com's offering.New York, NY – The premium skincare sector is witnessing a significant surge in growth with…","https://www.globenewswire.com/news-release/2024/03/15/2846872/28124/en/Global-Premium-Skincare-Products-Market-Set-to-Reach-78-7-Billion-by-2030-Amid-Rising-Consumer-Interest-in-Luxury-Beauty.html"
"Global Skincare Packaging Market Valuation Set to Total US$ 25,590.3 Million by 2034 Amid Rising Demand for Skincare Products Globally | Future Market Insights Inc.","Future Market Insights Global and Consulting Pvt. Ltd.","2024-04-01T14:30:00Z","Germany is one of the leading skincare packaging markets across Europe and is poised to grow at 1.3% CAGR through 2034. This is attributable to flourishing cosmetics industry in the country, booming e-commerce, and growing popularity of natural and organic sk…","https://www.globenewswire.com/news-release/2024/04/01/2855267/0/en/Global-Skincare-Packaging-Market-Valuation-Set-to-Total-US-25-590-3-Million-by-2034-Amid-Rising-Demand-for-Skincare-Products-Globally-Future-Market-Insights-Inc.html"
"American shows difference in how she does her makeup now she's in Europe","newsweek.com","2024-03-20T17:10:07Z","French women are forever at the center of the fashion and beauty world, whether you're looking to embrace their effortlessly chic style or want to hit a French pharmacy to stock up on skincare. While there's no denying the French have influenced many trends, …","https://biztoc.com/x/aa8e8335d0d1c669"
"Global Ceramide Skincare Market to reach a valuation of US$ 739.4 million by 2034 | Future Market Insights Inc.","Future Market Insights Global and Consulting Pvt. Ltd.","2024-03-27T00:30:00Z","Increasing environmental and sustainability awareness, coupled with a global aging population, will propel the demand for clean and sustainable ceramide skincare products. Consumers are seeking eco-friendly options to address aging skin concerns, driving the …","https://www.globenewswire.com/news-release/2024/03/27/2852860/0/en/Global-Ceramide-Skincare-Market-to-reach-a-valuation-of-US-739-4-million-by-2034-Future-Market-Insights-Inc.html"
"Global Vitamin A Market Trends and Forecasts to 2029: Growing Demand for Natural and Organic Vitamin A","Research and Markets","2024-03-26T09:07:00Z","Dublin, March 26, 2024 (GLOBE NEWSWIRE) -- The ""Global Vitamin A Market: Analysis By Type, By Product, By Application, By Region Size,Trends and Forecast to 2029"" report has been added to ResearchAndMarkets.com's offering.The global vitamin A market value sto…","https://www.globenewswire.com/news-release/2024/03/26/2852163/28124/en/Global-Vitamin-A-Market-Trends-and-Forecasts-to-2029-Growing-Demand-for-Natural-and-Organic-Vitamin-A.html"
"Global Skin Toner Analysis Report 2024: Market Value to Reach $1.73 Billion by 2029, Driven by Surging Preference for Organic Skincare Products and Growing Influence of Social Media","Research and Markets","2024-03-20T10:41:00Z","Dublin, March 20, 2024 (GLOBE NEWSWIRE) -- The ""Global Skin Toner Market: Analysis By Type, By Category, By Distribution Channel, By Region Size and Trends with Impact Analysis of COVID-19 and Forecast up to 2029"" report has been added to ResearchAndMarkets.c…","https://www.globenewswire.com/news-release/2024/03/20/2849195/28124/en/Global-Skin-Toner-Analysis-Report-2024-Market-Value-to-Reach-1-73-Billion-by-2029-Driven-by-Surging-Preference-for-Organic-Skincare-Products-and-Growing-Influence-of-Social-Media.html"
"Earnings call: Ulta Beauty's skincare drives Q4 growth, Mexico expansion planned","Investing.com","2024-03-15T15:31:37Z","Earnings call: Ulta Beauty's skincare drives Q4 growth, Mexico expansion planned","https://www.investing.com/news/stock-market-news/earnings-call-ulta-beautys-skincare-drives-q4-growth-mexico-expansion-planned-93CH-3340315"
"Korea Cosmetics (K-Beauty) Market Analysis Report 2024-2029: Increasing Popularity Of K-content, Growing Emergence of Smaller Brands, Rise Of ODMs, and Increasing Influence Of Social Media","Research and Markets","2024-04-03T11:26:00Z","Dublin, April 03, 2024 (GLOBE NEWSWIRE) -- The ""Korea Cosmetics (K-Beauty) Market: Analysis By Type, By Category, By Distribution Channel, By Exports, By Production, Size and Trends with Impact of COVID-19 and Forecast up to 2029"" report has been added to Res…","https://www.globenewswire.com/news-release/2024/04/03/2856812/28124/en/Korea-Cosmetics-K-Beauty-Market-Analysis-Report-2024-2029-Increasing-Popularity-Of-K-content-Growing-Emergence-of-Smaller-Brands-Rise-Of-ODMs-and-Increasing-Influence-Of-Social-Med.html"
"Snail Mucin Skincare Market Soars: Forecasting a 6.5% CAGR Growth by 2034 | Future Market Insights, Inc.","Future Market Insights Global and Consulting Pvt. Ltd.","2024-03-22T00:30:00Z","The snail mucin skincare market is booming, driven by its natural healing properties. Consumers seek its hydrating, anti-aging benefits, fueling its rapid growth globally. The snail mucin skincare market is booming, driven by its natural healing properties. C…","https://www.globenewswire.com/news-release/2024/03/22/2850720/0/en/Snail-Mucin-Skincare-Market-Soars-Forecasting-a-6-5-CAGR-Growth-by-2034-Future-Market-Insights-Inc.html"
"Global Anti-acne Dermal Patch Market is expected to advance at a 6.5% CAGR by 2034, attaining a valuation of US$ 1.1 billion | Future Market Insights Inc.","Future Market Insights Global and Consulting Pvt. Ltd.","2024-03-19T00:30:00Z","Regulatory-approved anti-acne dermal patches offer consumers confidence in both efficacy and safety. Such approval not only assures quality but also drives market expansion by influencing consumer trust. Regulatory assistance plays a pivotal role in shaping t…","https://www.globenewswire.com/news-release/2024/03/19/2848255/0/en/Global-Anti-acne-Dermal-Patch-Market-is-expected-to-advance-at-a-6-5-CAGR-by-2034-attaining-a-valuation-of-US-1-1-billion-Future-Market-Insights-Inc.html"
"Emollient Market to Attain US$ 2.9 Billion at 5.6% CAGR by 2034: Fact.MR Analysis","FACT.MR","2024-04-09T11:00:00Z","Clean beauty movement driving demand for natural and sustainable emollients. Clean beauty movement driving demand for natural and sustainable emollients.","https://www.globenewswire.com/news-release/2024/04/09/2859823/0/en/Emollient-Market-to-Attain-US-2-9-Billion-at-5-6-CAGR-by-2034-Fact-MR-Analysis.html"
"Global Skin Care Supplements Market Size, Share & Trends Analysis Report 2024-2030, with Profiles of Amway, Hum Nutrition, Nestle, Meiji, Plix The Plant Fix, Perricone MD, TCH and Vitabiotics","Research and Markets","2024-04-09T15:21:00Z","Dublin, April 09, 2024 (GLOBE NEWSWIRE) -- The ""Global Skin Care Supplements Market Size, Share & Trends Analysis Report by Product Type (Oral Supplements, Topical Supplements), Content Type, Formulation, Application, Gender, Distribution Channel, Region, and…","https://www.globenewswire.com/news-release/2024/04/09/2860202/28124/en/Global-Skin-Care-Supplements-Market-Size-Share-Trends-Analysis-Report-2024-2030-with-Profiles-of-Amway-Hum-Nutrition-Nestle-Meiji-Plix-The-Plant-Fix-Perricone-MD-TCH-and-Vitabiotic.html"
"Elevai Labs Launches E-commerce Portal to Support Rapid Growth as Stem Cell Exosome Disruptor in the $19.7 Billion Global Physician Dispensed Cosmeceutical Market","GlobeNewswire","2024-03-18T12:31:36Z","ELEVAI Physician-Dispensed Skincare Now Available Direct to Consumers NEWPORT BEACH, Calif., March 18, 2024 (GLOBE NEWSWIRE) — ELEVAI LABS, INC., (NASDAQ: ELAB) a medical aesthetic company specializing in physician-dispensed skin care, is proud to announce th…","https://financialpost.com/globe-newswire/elevai-labs-launches-e-commerce-portal-to-support-rapid-growth-as-stem-cell-exosome-disruptor-in-the-19-7-billion-global-physician-dispensed-cosmeceutical-market"
"Medical Spa Market Projected to Surpass US$ 70,648.2 Million by 2034, with a 6.80% CAGR Growth Forecast | Future Market Insights, Inc.","Future Market Insights Global and Consulting Pvt. Ltd.","2024-03-14T14:30:00Z","Rapid growth in medical spas driven by wellness awareness, non-invasive procedures & aging population. Challenges include regulatory hurdles & competition, yet market thrives on preventive healthcare trends Rapid growth in medical spas driven by wellness awar…","https://www.globenewswire.com/news-release/2024/03/14/2846439/0/en/Medical-Spa-Market-Projected-to-Surpass-US-70-648-2-Million-by-2034-with-a-6-80-CAGR-Growth-Forecast-Future-Market-Insights-Inc.html"
"A2 Milk Analysis Report 2024: Global Market to Reach $47.8 Billion by 2032, Driven by Expansion into Skincare and Cosmetic Products and Rising Lactose Intolerances","Research and Markets","2024-03-18T09:54:00Z","Dublin, March 18, 2024 (GLOBE NEWSWIRE) -- The ""A2 Milk Market Report by End-Use (Liquid Milk, Infant Formula, and Others), Distribution Channel (Supermarkets and Hypermarkets, Convenience and Grocery Stores, Online/Non-Store Retailing, and Others), and Regio…","https://www.globenewswire.com/news-release/2024/03/18/2847589/28124/en/A2-Milk-Analysis-Report-2024-Global-Market-to-Reach-47-8-Billion-by-2032-Driven-by-Expansion-into-Skincare-and-Cosmetic-Products-and-Rising-Lactose-Intolerances.html"
"Waldencast regains Nasdaq compliance, faces monitoring","Investing.com","2024-03-25T21:13:46Z","Waldencast regains Nasdaq compliance, faces monitoring","https://www.investing.com/news/stock-market-news/waldencast-regains-nasdaq-compliance-faces-monitoring-93CH-3352342"
"Piper Sandler maintains price target on Kenvue shares, cites brand growth","Investing.com","2024-04-09T17:45:34Z","Piper Sandler maintains price target on Kenvue shares, cites brand growth","https://www.investing.com/news/company-news/piper-sandler-maintains-price-target-on-kenvue-shares-cites-brand-growth-93CH-3371829"
"[Latest] India Cosmetic Market Size/Share Worth USD 18.4 Billion by 2032 at a 3.2% CAGR: Custom Market Insights (Analysis, Outlook, Leaders, Report, Trends, Forecast, Segmentation, Growth, Growth Rate, Value)","CMI MARKET RESEARCH PRIVATE LIMITED","2024-03-21T16:30:00Z","[220+ Pages Latest Report] According to a market research study published by Custom Market Insights, the demand analysis of India Cosmetic Market size & share revenue was valued at approximately USD 5.9 Billion in 2022 and is expected to reach USD 8.1 Billion…","https://www.globenewswire.com/news-release/2024/03/21/2850454/0/en/Latest-India-Cosmetic-Market-Size-Share-Worth-USD-18-4-Billion-by-2032-at-a-3-2-CAGR-Custom-Market-Insights-Analysis-Outlook-Leaders-Report-Trends-Forecast-Segmentation-Growth-Grow.html"
"Waldencast Regains Compliance with Nasdaq Filing Requirements","Waldencast plc.","2024-03-25T21:05:00Z","WHITE PLAINS, N.Y., March 25, 2024 (GLOBE NEWSWIRE) -- Waldencast plc, (NASDAQ: WALD) (""Waldencast""), a global multi-brand beauty and wellness platform, announced that on March 21, 2024 the Company received formal notice from the Nasdaq Hearings Panel (the ""P…","https://www.globenewswire.com/news-release/2024/03/25/2852030/0/en/Waldencast-Regains-Compliance-with-Nasdaq-Filing-Requirements.html"
"Waldencast Regains Compliance with Nasdaq Filing Requirements","N/A","2024-03-25T21:05:04Z","(marketscreener.com) WHITE PLAINS, N.Y., March 25, 2024 -- Waldencast plc, , a global multi-brand beauty and wellness platform, announced that on March 21, 2024 the Company received formal notice from the Nasdaq Hearings Panel confirming that it has regained …","https://www.marketscreener.com/quote/stock/WALT-ACQU-122525450/news/Waldencast-Regains-Compliance-with-Nasdaq-Filing-Requirements-46279635/"
"Synthetic Beta-Carotene Market is Forecasted to Reach US$ 433.6 Million by 2034, States Fact.MR","FACT.MR","2024-03-27T08:00:00Z","Advancements in Production Technologies Leading to Development of Enhanced and Cost-Effective Synthetic Beta-Carotene Advancements in Production Technologies Leading to Development of Enhanced and Cost-Effective Synthetic Beta-Carotene","https://www.globenewswire.com/news-release/2024/03/27/2852944/0/en/Synthetic-Beta-Carotene-Market-is-Forecasted-to-Reach-US-433-6-Million-by-2034-States-Fact-MR.html"
"Phenoxyethanol Market is expected to reach US$ 2,364 million by 2034, rising at a 3.10% CAGR - FMI Estimate","Future Market Insights Global and Consulting Pvt. Ltd.","2024-04-03T18:00:00Z","The surge in demand for natural and organic products fuels the adoption of plant-derived phenoxyethanol alternatives. The United State phenoxyethanol market is forecasted to experience a remarkable compound annual growth rate (CAGR) of 14.80%. The surge in de…","https://www.globenewswire.com/news-release/2024/04/03/2857292/0/en/Phenoxyethanol-Market-is-expected-to-reach-US-2-364-million-by-2034-rising-at-a-3-10-CAGR-FMI-Estimate.html"
"Personal Care and Cosmetics Preservatives Market to Thrive with Progressive and Natural Solutions Amidst Regulatory Shifts","Research and Markets","2024-03-20T09:02:00Z","Dublin, March 20, 2024 (GLOBE NEWSWIRE) -- The ""Global Personal Care and Cosmetics Preservatives Growth Opportunities"" report has been added to ResearchAndMarkets.com's offering.","https://www.globenewswire.com/news-release/2024/03/20/2849159/28124/en/Personal-Care-and-Cosmetics-Preservatives-Market-to-Thrive-with-Progressive-and-Natural-Solutions-Amidst-Regulatory-Shifts.html"
"Infrastructure Building Projects Drive the Demand of Bucket Market: Expected to Grow at a CAGR of 2% until 2034, predict FMI’s Analysts","Future Market Insights Global and Consulting Pvt. Ltd.","2024-03-29T12:30:00Z","The bucket market is predominantly utilized in infrastructure development projects in the United States. The market substantially includes the construction of roads, bridges, commercial buildings, and residential complexes. Buckets are commonly employed for e…","https://www.globenewswire.com/news-release/2024/03/29/2854726/0/en/Infrastructure-Building-Projects-Drive-the-Demand-of-Bucket-Market-Expected-to-Grow-at-a-CAGR-of-2-until-2034-predict-FMI-s-Analysts.html"
"Waldencast Reports First Half 2023 Results","Waldencast plc.","2024-03-21T02:00:00Z","—  H1’23 Total Net Revenue of $109.3 million—  H1’23 Combined Adjusted EBITDA of $13.9 million up from $7.6 million in H1’22—  Introduces guidance   ...","https://www.globenewswire.com/news-release/2024/03/21/2849892/0/en/Waldencast-Reports-First-Half-2023-Results.html"
"Waldencast Reports First Half 2023 Results","N/A","2024-03-21T02:01:05Z","(marketscreener.com) —  H1’23 Total Net Revenue of $109.3 million—  H1’23 Combined Adjusted EBITDA of $13.9 million up from $7.6 million in H1’22—  Introduces guidance WHITE PLAINS, N.Y., March 20, 2024 -- Waldencast plc , a global multi-brand beauty and well…","https://www.marketscreener.com/quote/stock/WALT-ACQU-122525450/news/Waldencast-Reports-First-Half-2023-Results-46247553/"
"Nylon in Personal Care & Cosmetics Market To Reach USD 4.4 Billion By 2032 - DataHorizzon Research","DataHorizzon Research","2024-04-07T09:30:00Z","Global Cosmetics Industry to Gain Traction Due to Growing Demand for Nylon in Personal Care & Cosmetics. Global Cosmetics Industry to Gain Traction Due to Growing Demand for Nylon in Personal Care & Cosmetics.","https://www.globenewswire.com/news-release/2024/04/07/2858822/0/en/Nylon-in-Personal-Care-Cosmetics-Market-To-Reach-USD-4-4-Billion-By-2032-DataHorizzon-Research.html"
"Global Personal Care Chemicals Market Size is projected to reach USD 19.29 billion by 2031, growing at a CAGR of 3.94%: Straits Research","Straits Research Private Limited - Reed Intelligence","2024-03-21T13:40:00Z","According to Straits Research, ""The global personal care chemicals market size was valued at USD 13.63 billion in 2022. It is estimated to reach USD 19.29 billion by 2031, growing at a CAGR of 3.94% during the forecast period (2023–2031)."" According to Strait…","https://www.globenewswire.com/news-release/2024/03/21/2850317/0/en/Global-Personal-Care-Chemicals-Market-Size-is-projected-to-reach-USD-19-29-billion-by-2031-growing-at-a-CAGR-of-3-94-Straits-Research.html"
"Colour Cosmetics Market Poised to Reach US$116 Bn by 2030, Estimates Fairfield Market Research","Fairfield Consultancy Services OPC Pvt Ltd","2024-04-10T14:01:00Z","Influenced by Evolving Consumer Preferences and Increasing demand for personalized beauty solutions, the Global Market for Colour Cosmetics is Projected to Experience Continued Growth in the Coming Years Influenced by Evolving Consumer Preferences and Increas…","https://www.globenewswire.com/news-release/2024/04/10/2860862/0/en/Colour-Cosmetics-Market-Poised-to-Reach-US-116-Bn-by-2030-Estimates-Fairfield-Market-Research.html"
"AMWC 2024: Galderma to Share New Data From Its Leading Injectable Aesthetic Portfolio","Business Wire","2024-03-19T06:09:13Z","Galderma’s diverse portfolio and educational efforts will be highlighted in 16 posters, and two sponsored symposia, exploring insights from the ground-breaking ‘NEXT by Galderma’ future aesthetic trends report and the use of Sculptra® for the body, as we cele…","https://financialpost.com/pmn/business-wire-news-releases-pmn/amwc-2024-galderma-to-share-new-data-from-its-leading-injectable-aesthetic-portfolio"
"MarketingPulse and eTailingPulse attract 1600 industry professionals","InvestorsObserver","2024-03-14T00:39:00Z","MarketingPulse and eTailingPulse attract 1600 industry professionals           PR Newswire             Some 80 renowned speakers from around the world focus on         hot topics in marketing and e-commerce           The parallel   MarketingPulse   and...","https://www.investorsobserver.com/news/qm-pr/8249053091495283"
"Brands Set Sights on Multibillion-Dollar TikTok Commerce Opportunity Despite Uncertainty","PYMNTS","2024-04-02T21:26:39Z","Even as the future of TikTok hangs in the balance, brands continue to leverage the platform’s wide audience of young consumers to drive engagement and sales. E.l.f. Beauty, for instance, announced Friday (March 29) that its e.l.f. Cosmetics business was the f…","https://www.pymnts.com/news/social-commerce/2024/brands-set-sights-on-multibillion-dollar-tiktok-commerce-opportunity-despite-uncertainty/"
