"Title","Author","PublishedAt","Description","URL"
"The Terminator wants to sell you face cream: how AI influencers are taking over Instagram","Clem De Pressigny","2024-04-09T09:41:02Z","Sorry, Gen Z. The influencer market is getting saturated — and now AI influencers are picking up brand deals. But that may end up being a good thing.","https://www.businessinsider.com/gen-z-influencer-marketing-career-goal-ai-social-media-instagram-2024-4"
"Spotlight: Deluvia Offers a Unique Twist on Skincare and Cosmetics","Annie Pilon","2024-03-13T09:38:28Z","Deluvia Skincare and Cosmetics makes clean products with minerals from the Dead Sea, Aloe Vera, Manuka Honey, botanicals, and plant extract.","https://smallbiztrends.com/?p=1476869"
"Best Things to Make and Sell from Home in 2024","Samson Haileyesus","2024-04-02T19:00:35Z","Here's a guide to the top things to make and sell from home so you an start a business you can control and grow from the comfort of your home.","https://smallbiztrends.com/2024/04/things-to-make-and-sell-from-home-2.html"
"Here Are the Best Amazon Spring Sale Beauty Deals to Shop Right Now","Jasmin Sandal","2024-03-19T23:03:38Z","There’s never been a better time to save than during Amazon’s latest sale event, get up to 50% off best-selling makeup, grooming devices, hair care and more","http://www.rollingstone.com/product-recommendations/lifestyle/amazon-big-spring-sale-beauty-deals-1234989778/"
"Open Wide: 'Skinification' Is Coming For Your Mouth","N/A","2024-03-20T17:32:04Z","With the skinification of of oral care, brushing and flossing twice daily is no longer enough. Consumers are optimizing their dental routines with next-gen ingredients and packaging.","https://www.highsnobiety.com/p/skinification-of-oral-dental-care/"
"Why CeraVe, Velveeta and Bottega Veneta Are Putting the Paparazzi on Speed Dial","Rebecca Stewart","2024-04-05T10:00:00Z","While some A-listers shirk the paparazzi, others accept the press pack are part and parcel of show business. Some celebrities even stage their own photoshoots, inviting photographers to capture seemingly candid moments and shop them around the tabloids. Now a…","https://www.adweek.com/brand-marketing/why-cerave-velveeta-and-bottega-veneta-are-putting-the-paparazzi-on-speed-dial/"
"Can rice, beetroot powder and aloe vera help you achieve glowing skin?","Lifestyle Desk","2024-03-25T07:01:35Z","Confused about DIY skincare trends?  Experts weigh in on the benefits of rice, beetroot powder & aloe vera for glowing skin and how to safely integrate them into your routine for a radiant complexion.","https://indianexpress.com/article/lifestyle/life-style/skincare-diy-rice-beetroot-powder-aloe-vera-skin-glow-9222794/"
"GenAI And Holistic Beauty: A Guide To What’s Next In Beauty Tech","Sampo Parkkinen, Forbes Councils Member,   Sampo Parkkinen, Forbes Councils Member  https://www.forbes.com/sites/forbestechcouncil/people/sampoparkkinen/","2024-03-28T10:45:00Z","As we step into 2024 and beyond, these exciting trends and the integration of GenAI are ushering in a whole new era of beauty.","https://www.forbes.com/sites/forbestechcouncil/2024/03/28/genai-and-holistic-beauty-a-guide-to-whats-next-in-beauty-tech/"
"Therabody’s Tim Roberts Talks Using Technology To Make Living Better, Accessible Personal Health In Interview","Steven Aquino, Contributor,   Steven Aquino, Contributor  https://www.forbes.com/sites/stevenaquino/","2024-04-05T18:31:07Z","Therabody makes devices designed to aid people in wellness and other areas of personal health such as recovery and skincare.","https://www.forbes.com/sites/stevenaquino/2024/04/05/therabodys-tim-roberts-talks-using-technology-to-make-living-better-accessible-personal-health-in-interview/"
"These Are The Top Lip Trends For 2024, According To Experts","Jessica Ourisman, Contributor,   Jessica Ourisman, Contributor  https://www.forbes.com/sites/jessicaourisman/","2024-03-28T15:30:10Z","These are the top lip treatment, trends, and products to try in 2024, according to skin and aesthetic experts.","https://www.forbes.com/sites/jessicaourisman/2024/03/28/these-are-the-top-lip-trends-for-2024-according-to-experts/"
"How AI And AR Are Enhancing The Beauty Space","Jia Rizvi, Contributor,   Jia Rizvi, Contributor  https://www.forbes.com/sites/jiawertz/","2024-04-08T18:37:32Z","These groundbreaking innovations have not only changed how consumers interact with beauty products but have also revolutionized the way brands market and sell their of...","https://www.forbes.com/sites/jiawertz/2024/04/08/how-ai-and-ar-are-enhancing-the-beauty-space/"
"Breaking The Mold: Stand Out By Challenging Norms","Bora Celik, Forbes Councils Member,   Bora Celik, Forbes Councils Member  https://www.forbes.com/sites/forbesbusinesscouncil/people/boracelik/","2024-04-11T11:30:00Z","Innovation thrives on the edge of comfort zones.","https://www.forbes.com/sites/forbesbusinesscouncil/2024/04/11/breaking-the-mold-stand-out-by-challenging-norms/"
"The Founder's Touch: Using Personal Experience To Shape Your Brand","Bora Celik, Forbes Councils Member,   Bora Celik, Forbes Councils Member  https://www.forbes.com/sites/forbesbusinesscouncil/people/boracelik/","2024-03-13T12:30:00Z","Here's how the founders of six companies, each with a unique narrative, translated their personal passion into products that resonate deeply with consumers.","https://www.forbes.com/sites/forbesbusinesscouncil/2024/03/13/the-founders-touch-using-personal-experience-to-shape-your-brand/"
"Influencer Marketing 3.0: A Dive Into AI's Impact On Engagement","Chiranjiv Roy, Forbes Councils Member,   Chiranjiv Roy, Forbes Councils Member  https://www.forbes.com/sites/forbestechcouncil/people/chiranjivroy/","2024-03-12T14:00:00Z","While AI's prowess in content creation, especially video, introduces a new era of personalized engagement, we're still navigating its full spectrum of capabilities.","https://www.forbes.com/sites/forbestechcouncil/2024/03/12/influencer-marketing-30-a-dive-into-ais-impact-on-engagement/"
"Aussie Brands ‘Speed Dating’ And Live Streaming To Success With Alibaba","Jon Bird, Contributor,   Jon Bird, Contributor  https://www.forbes.com/sites/jonbird1/","2024-03-20T05:12:35Z","How to succeed in the second biggest consumer market in the world? Alibaba's E-Commerce Expo in Sydney provides a gateway to China and SE Asia for Australian brands.","https://www.forbes.com/sites/jonbird1/2024/03/20/aussie-brands-speed-dating-and-live-streaming-to-success-with-alibaba/"
"Dermatology Marketing: How To Navigate The Changing Landscape","Ajay Prasad, Forbes Councils Member,   Ajay Prasad, Forbes Councils Member  https://www.forbes.com/sites/forbesagencycouncil/people/ajayprasad1/","2024-03-13T11:15:00Z","Consumerism has taken over the healthcare industry, and dermatology is no exception.","https://www.forbes.com/sites/forbesagencycouncil/2024/03/13/dermatology-marketing-how-to-navigate-the-changing-landscape/"
"Redefining The Narrative Around Menopause: The Story Of Womaness","Angela Chan, Contributor,   Angela Chan, Contributor  https://www.forbes.com/sites/angelachan/","2024-03-30T12:52:41Z","Menopause is a natural phase in a woman's life, yet it has been overlooked and stigmatized for far too long.","https://www.forbes.com/sites/angelachan/2024/03/30/redefining-the-narrative-around-menopause-the-story-of-womaness/"
"The Power Of First Impressions: 5 Tips That Can Impact Your Business","Stephanie (Stifel) Coughlan, Forbes Councils Member,   Stephanie (Stifel) Coughlan, Forbes Councils Member  https://www.forbes.com/sites/forbesbusinesscouncil/people/stephaniecoughlan/","2024-04-08T13:30:00Z","Understanding the dynamics of first impressions and how to wield them effectively can significantly impact your success in business.","https://www.forbes.com/sites/forbesbusinesscouncil/2024/04/08/the-power-of-first-impressions-5-tips-that-can-impact-your-business/"
"55 Best Graduation Gifts In 2024, From Personalized To Practical","Samantha Simon, Contributor,   Samantha Simon, Contributor  https://www.forbes.com/sites/forbes-personal-shopper/people/samanthasimon/","2024-03-27T21:34:47Z","Celebrate your recent grad's achievements with one of these 55 best graduation gifts, carefully chosen by our expert gift editors.","https://www.forbes.com/sites/forbes-personal-shopper/2024/03/27/best-graduation-gifts/"
"The 44 Best Graduation Gifts To Mark The Special Milestone","Samantha Simon, Contributor,   Samantha Simon, Contributor  https://www.forbes.com/sites/forbes-personal-shopper/people/samanthasimon/","2024-03-15T16:47:41Z","Whether they’re saying goodbye to high school or college, send them off with one of the best graduation gifts of 2024, carefully chosen by our expert gift editors.","https://www.forbes.com/sites/forbes-personal-shopper/2024/03/15/best-graduation-gifts/"
"Why Jennifer Garner's Vital—""Not Viral""—Beauty Tips Will Influence You","Alyssa Morin","2024-03-27T17:53:52Z","Jennifer Garner's got a new alias: skincare guru. The 13 Going on 30 star recently offered her words of wisdom on aging and her refreshingly relatable approach to beauty. ""We should know how to...","https://www.eonline.com/news/1398281/why-jennifer-garners-vital-not-viral-beauty-tips-are-guaranteed-to-influence-you"
"A Beginner’s Guide to Business Marketing","N/A","2024-03-12T15:45:00Z","Learn the basics of business marketing. Including five foundational tips to set you up for success.","https://www.semrush.com/blog/business-marketing/"
"26 Types of Digital Advertising: The Ultimate List","N/A","2024-03-27T10:22:00Z","From search and social media ads to mobile ads, learn about various types of digital advertising campaigns.","https://www.semrush.com/blog/types-of-digital-advertising/"
"Video Marketing: The Ultimate Guide for 2024","N/A","2024-03-12T13:38:00Z","Interested in video marketing? Learn how to create your first marketing video in this step-by-step guide.","https://www.semrush.com/blog/video-marketing/"
"The Beauty Show Is Coming: Here's How You Can Get Into the Who What Wear Trend Salon","eleanor.vousden@futurenet.com (Eleanor Vousden)","2024-03-25T06:51:00Z","The Beauty Show 2024 is here, and if you're ready to discover the latest trends, best products and most exciting innovations in beauty, book your ticket here.","https://www.whowhatwear.com/the-beauty-show-2024"
"Sultry Vanilla Perfumes Are *It* for 2024—My Hot Take on 8 Favorites","Kaitlyn McLintock","2024-03-23T07:00:00Z","Sultry vanilla scents are in for 2024. Click here to see the 8 best ones, according to beauty editors.","https://www.whowhatwear.com/beauty/fragrance/sultry-vanilla-fragrance-trend"
"7 ""Outdated"" Beauty Products That Are Officially Making a Comeback in 2024","thatgracegirlblog@gmail.com (Grace Day)","2024-03-29T07:00:00Z","Discover the iconic beauty products that have started to resurface, proving just how well they stand the test of time.","https://www.whowhatwear.com/beauty/beauty-products-making-a-comeback-in-2024"
"Say Goodbye To Bags And Dark Circles With Our Favorite Under Eye Patches","Kayla Walden","2024-03-29T17:52:41Z","Looking tired from lack of sleep, insomnia, or endless scrolling til 2am? Me too! Which is why I've got some of our best picks for under-eye patches that'll make you look like a sleeping beauty who gets at LEAST 14 hours like our fave Dakota Johnson requires.…","https://www.brit.co/under-eye-patches/"
"From Dull to Dapper: How the Right Men’s Face Products Can Revolutionize Your Look in 2024","Kelly Larson","2024-03-20T15:05:53Z","When you look in the mirror, what do you see? And don’t get all existential on me—let’s keep things as surface-level as possible here. How are those pores looking? Any bags under your eyes? Taken a wrinkle inventory lately? Don’t...","https://www.fashionbeans.com/article/best-face-products-for-men/"
"The Ultimate Guide to Preppy Style for Men: A Timeless Aesthetic Revisited","FashionBeans Editors","2024-03-27T16:42:42Z","In the hallowed halls of Ivy League universities, amidst the rustling of heavy textbooks and the intellectual buzz of academic discourse, a distinct style quietly took root. This wasn’t just any fashion trend; it was preppy style, a sartorial choice...","https://www.fashionbeans.com/article/preppy-style"
"Old Money Style: A Timeless Approach to Menswear","Slider Slider","2024-04-10T12:43:01Z","Curious about the secrets of old money style but don’t have a Rockefeller-sized clothing budget? We’ve got you covered, old sport. Our team of sartorial sleuths has analyzed more than 200 legendary looks, grilled industry insiders, and dug deep into...","https://www.fashionbeans.com/article/old-money-style/"
"25 Best Men’s Grooming Products That Every Kempt Man Needs","Kelly Larson","2024-04-10T12:03:00Z","When I mention the ""best men’s grooming products,"" what’s the first thing that comes to mind? … So many things, right? Face washes. Exfoliating body washes. Eye creams. Anti-aging products. Anything and everything else that has to do with making...","https://www.fashionbeans.com/article/top-mens-grooming-products/"
"This Gentle La Roche-Posay Retinol Serum That Clears Acne and ‘Visibly Improves Wrinkles’ Is on Sale at Ulta Today","Fernando Snellings","2024-03-13T17:58:15Z","La Roche-Posay's retinol serum is a bestselling anti-aging serum that clears acne and smooths fine lines, and today it's on sale for under $40.","http://wwd.com/shop/shop-beauty/la-roche-posay-retinol-serum-deal-1236262562/"
"Why are early YouTube beauty videos so comforting?","Laura Molloy","2024-04-10T10:22:00Z","The circulation of old beauty vlogs on TikTok has led to collective mourning of simpler times... but were they really that good?","https://www.dazeddigital.com/beauty/article/62361/1/remember-the-comfortable-mundanity-of-early-beauty-youtube"
"I Ditched Heavy Foundations for the Radiance-Boosting E.l.f. Halo Glow Liquid Filter — Here’s Why It’s Worth the Hype","Olivia Cigliano","2024-03-20T14:40:00Z","One editor tested and reviewed the TikTok-famous E.l.f. Halo Glow Liquid Filter that provides a filter-like glow for a no-makeup makeup look.","http://wwd.com/shop/shop-beauty/elf-halo-glow-liquid-filter-1236270475/"
"[Removed]","N/A","1970-01-01T00:00:00Z","[Removed]","https://removed.com"
"[Removed]","N/A","1970-01-01T00:00:00Z","[Removed]","https://removed.com"
"20 High Quality Hand Creams for Dry, Cracked Skin","Fatima Gulzar","2024-03-20T20:46:38Z","In this article, we will discuss the 20 High Quality Hand Creams for Dry, Cracked Skin. You can skip our detailed analysis of the global hand cream industry ...","https://finance.yahoo.com/news/20-high-quality-hand-creams-204638296.html"
"8 Best Summer 2024 Nail Trends, According to Experts","Beth Gillette","2024-03-21T17:49:00Z","I asked a nail artist what the biggest summer 2024 nail trends will be, and she delivered, from trending shapes to summer colors to unique designs and finishes.","https://www.cosmopolitan.com/style-beauty/beauty/a60247579/summer-2024-nail-trends/"
"7 Best Summer 2024 Makeup Trends, According to Experts","Beth Gillette","2024-04-01T16:54:00Z","We're sharing the best summer 2024 makeup trends, according to runway shows and a celebrity makeup artist. Expect bright eyes, matte lips, and glowy skin.","https://www.cosmopolitan.com/style-beauty/beauty/a60321641/summer-2024-makeup-trends/"
"What Happens to the Stay-at-Home Girlfriend After a Breakup?","Erika W. Smith","2024-03-18T21:16:00Z","Stay-at-home girlfriend videos are going viral on TikTok, but what happens after a breakup? Cosmo talks to former SAHGs about rebuilding their lives.","https://www.cosmopolitan.com/sex-love/a60130675/stay-at-home-girlfriend-tik-tok-trend-breakups/"
"Interactive Posts: Steal these ideas and say goodbye to boring social media","Rhonda Bradley","2024-04-09T14:54:37Z","Have you ever dreamed about waking up to discover that your brand’s social media page went viral overnight?   Or that, within a few months, you were able to build a highly engaged audience that feels like a real community?   Social media success happens on di…","https://blog.aweber.com/learn/interactive-posts-for-social-media.htm"
"12 Best Festival Makeup Ideas to Copy for 2024","Beth Gillette","2024-04-08T18:35:00Z","Looking for festival makeup inspiration? We compiled the best trends for 2024, including rhinestones, glittery eyes, metallic lips, shimmery cheeks, and more.","https://www.cosmopolitan.com/style-beauty/beauty/a60410821/festival-makeup-ideas/"
"What to Do With Your Life in April—30 Ideas to Inspire the Ultimate Refresh","Isabelle Eyman","2024-04-01T20:59:06Z","Your chance to start entirely new. The post What to Do With Your Life in April—30 Ideas to Inspire the Ultimate Refresh appeared first on Camille Styles.","https://camillestyles.com/wellness/april-bucket-list/"
"30 Trends That People Voted As Highly Cringeworthy","Shanilou Perera","2024-03-26T13:42:53Z","Opinions on highly cringeworthy things people do that are way too normalised. The post 30 Trends That People Voted As Highly Cringeworthy appeared first on DeMilked.","https://www.demilked.com/highly-cringeworthy-trends/"
"25 Things That Can Seem Harmless But Are Dangerous According To Experts","Shanilou Perera","2024-03-12T13:53:08Z","Professionals share their expert opinions on 25 trends it would be wise to avoid. The post 25 Things That Can Seem Harmless But Are Dangerous According To Experts appeared first on DeMilked.","https://www.demilked.com/danger-advice-professional/"
"30+ Innovative Logo Designs: A Showcase of Modern Creativity","Muhammad Faisal","2024-04-03T19:42:21Z","Innovative logo designs transcend mere brand identification. They morph into potent narratives, weaving tales and forging a deep connection with the audience. Brands that unlock the power of this visual storytelling, coupled with a dash of trendsetting design…","https://graphicdesignjunction.com/2024/04/innovative-logo-designs/"
"Spring skincare, hair and beauty finds","Gretta Monahan","2024-03-21T04:40:01Z","From earth-friendly new face and body products to makeup color trends and iconic hair tools getting a huge refresh, opportunities to look your best are blooming.","https://www.bostonherald.com/2024/03/21/spring-skincare-hair-and-beauty-finds/"
"American Shows Difference in How She Does Her Makeup Now She Lives in Europe","Lollie Hancock","2024-03-20T17:00:24Z","Since moving to Paris from the US, the woman has stripped back her makeup routine. She took to Instagram to share the differences.","https://www.newsweek.com/makeup-differences-american-vs-french-1881339"
"The 21 Consumer Goods Companies That Are Earning More Americans' Trust","Jason Daniel Nuckolls","2024-04-11T19:18:44Z","These companies all appear on Newsweek's latest ranking of the Most Trustworthy Companies in America—and fared better than they did in last year's edition.","https://www.newsweek.com/21-consumer-goods-companies-that-are-earning-more-americans-trust-1888683"
"7 Fun Makeup Looks For Spring, Worn By Your Fave K-Pop Idols","sammilee","2024-03-14T09:24:56Z","Spring is around the corner, which means that warmer weather is finally coming! If you’re tired of the ""cold girl"" makeup trend or just want a refresh in general, here are some of the major makeup trends in K-pop you can recreate for yourself. New season, new…","https://www.soompi.com/article/1646120wpp/7-fun-makeup-looks-for-spring-worn-by-your-fave-k-pop-idols"
"How to Make Money on Pinterest: 4 Realistic Methods","Tommy Tindall","2024-03-20T19:24:45Z","You don't make money directly on Pinterest, but may be able to use it to promote your website or partner with brands for pay.","https://www.nerdwallet.com/article/finance/make-money-on-pinterest#article"
"Online is the new face of the booming beauty business","Ellen O'Regan","2024-03-15T06:00:00Z","Industry insiders say online business as much as tripled in size during the pandemic, fundamentally changing the sector","https://www.irishtimes.com/business/2024/03/15/online-is-the-new-face-of-the-booming-beauty-business/"
"Meet The Esthetician Behind New York’s Most Coveted Facial","Adi Giesey","2024-03-18T16:30:02Z","Have you ever discovered a new spot and immediately wanted to tell all your friends about it… but also selfishly gatekeep it for yourself? That’s how I feel about Ställe Studios, a skincare oasis hidden away on the edge of Soho with esthetician Elizabeth Grac…","https://coveteur.com/elizabeth-grace-hand-stalle-studios"
"Do kids still get allowances?","TheGrio Lifestyle","2024-03-13T18:32:59Z","Though Larsa Pippen gives her daughter a $2,500 monthly allowance, can the average American family afford and/or benefit from the […] The post Do kids still get allowances? appeared first on TheGrio.","http://thegrio.com/2024/03/13/do-kids-still-get-allowances/"
"Owners of Clarins, Courtin Family Diversifies Portfolio with Luxury Hotels","Joe Lim","2024-03-19T05:17:55Z","Renowned luxury hotel chain Evok collection sees strategic investment from the Courtin Family, who also owns beauty brand Clarins, in an effort to ""create unique experiences focused on well-being"". The post Owners of Clarins, Courtin Family Diversifies Portfo…","https://www.luxuo.com/homepage-slider/the-courtin-family-who-owns-clarins-invests-in-luxury-hotels.html"
"Owners of Clarins, Courtin Family Diversifies Portfolio with Luxury Hotels","Joe Lim","2024-03-19T05:17:55Z","Renowned luxury hotel chain Evok collection will now be owned by the Courtin Family, who also owns beauty brand Clarins, in an effort to ""create unique experiences focused on well-being"". The post Owners of Clarins, Courtin Family Diversifies Portfolio with L…","https://www.luxuo.com/properties/the-courtin-family-who-owns-clarins-invests-in-luxury-hotels.html"
"Sales-Focused Fashion Industry Turns to Beauty","Sanjeeva Suresh","2024-03-25T11:08:16Z","Utilising the ""lipstick effect"", can the power of perfumes and the blissful beauty industry overcome a slump in fashion sales?  The post Sales-Focused Fashion Industry Turns to Beauty appeared first on LUXUO.","https://www.luxuo.com/homepage-slider/sales-focused-fashion-industry-turns-to-beauty.html"
"Achieve Peak Wellness At Home With Get Golden Founder Jenelle Manzi","Annie Goodman","2024-03-14T11:00:17Z","WHEN CEO & FOUNDER Jenelle Manzi's Get Golden organic nut + seed bars came across our proverbial desks, we had to know more about this former professional ballerina-turned-wellness extraordinaire. Jenelle began her professional ballet career at age 16, travel…","http://thechalkboardmag.com/wellness-at-home-get-golden-founder/"
"Rejection motivates me to be better – Toluwani George","Faith Ajayi","2024-03-16T23:03:36Z","Background I attended Glory Academy for my primary and secondary education. I went on to bag a degree in Adult Education/Political Science from the University of Ibadan. To be honest, the course I studied was not by choice. The plan was to transfer to another…","https://punchng.com/rejection-motivates-me-to-be-better-toluwani-george/"
"Don’t wait for Prime Day — We found the 100+ best deals at Amazon’s Big Spring Sale","Victoria Giardina","2024-03-20T10:30:00Z","Spring into savings ASAP!","https://nypost.com/shopping/best-amazon-big-spring-sale-deals-2024/"
"Gen Z would ‘rather die hot than live ugly’ as they revive tanning bed trend","Brooke Kato","2024-03-15T15:20:55Z","Gen Z youths are bringing back tanning, much to the chagrin of older generations who learned too late of the damages inflicted by sunbeds, UV rays and tanning oils.","https://nypost.com/2024/03/15/lifestyle/gen-z-would-rather-die-hot-than-live-ugly-revive-tanning-beds/"
"‘RHODubai’ star Lesa Milan: How I got Beyoncé, Khloé Kardashian and Rihanna to wear my maternity line","Evan Real","2024-04-03T23:57:17Z","""The key in fashion is to reach out to the stylist,"" the Bravolebrity tells Page Six Style, explaining that persistent DMs helped her succeed in securing A-list brand support.","https://pagesix.com/2024/04/03/style/rhodubai-star-lesa-milan-on-beyonce-rihanna-wearing-mina-roe-maternity-line/"
"The magic formula of celeb-owned brands","Meenakshi Verma Ambwani","2024-04-01T04:23:37Z","Bollywood stars are hitting the jackpot with successful brand collaborations in the booming beauty and personal care industry. But celebs aren’t restricting themselves to the beauty segment alone. They are monetising their popularity with business ventures in…","https://www.thehindubusinessline.com/catalyst/the-magic-formula-of-celeb-owned-brands/article68014989.ece"
"Startups sync and swim with new investors","Pranav Mukul","2024-04-08T00:31:00Z","Startups witness a shift in investment trends. Domestic investors, family offices, and public market investors like ValueQuest and Singularity Ventures actively back ventures. Investment landscape changes as global funds retreat, and founders turn to investme…","https://economictimes.indiatimes.com/tech/startups/startups-sync-and-swim-with-new-investors/articleshow/109117375.cms"
"Premiumization, omnichannel trends, diversity to shape marketing in India: Kantar report","Suneera Tandon","2024-03-12T12:13:09Z","This shift, alongside an increase in digital marketing and e-commerce, reflects the diverse preferences of a youthful demographic and an affluent, value-conscious consumer base","https://www.livemint.com/industry/premiumization-omnichannel-trends-diversity-to-shape-marketing-in-india-kantar-report-11710241065006.html"
